<Defs xmlns:xsi="http://www.w3.org/2001/XMLSchema-instance" xsi:noNamespaceSchemaLocation="../../../Schemas/MorphDef.xsd">
    <Pawnmorph.MorphDef ParentName="PMI_CombatInsectBase">
        <defName>PMI_MegaSpiderMorph</defName>
        <label>megaspider morph</label>
        <description>Megaspiders are feared across known space, and the humanoid morphs of them are no exception. Combining the ferocity in combat of the megaspider with the relative intellect of a human, these morphs are often very dangerous.</description>
        <race>Megaspider</race>
        <fullTransformation>PMI_MegaSpiderMorphTf</fullTransformation>
        <partialTransformation>PMI_MegaSpiderMorphTfPartial</partialTransformation>
    </Pawnmorph.MorphDef>
</Defs>