<Defs xmlns:xsi="http://www.w3.org/2001/XMLSchema-instance" xsi:noNamespaceSchemaLocation="../../../Schemas/MorphDef.xsd">
    <Pawnmorph.MorphDef ParentName="PMI_ProductionInsectBase">
        <defName>PMI_RoyalMaggotMorph</defName>
        <label>royal maggotmorph</label>
        <description>A foul odour and slimy trail follows these 'maggotmorphs' wherever they go. However, they do sometimes produce royal jelly, so some choose to keep them around for it.</description>
        <race>Megaspider</race>
        <fullTransformation>PMI_RoyalMaggotMorphTf</fullTransformation>
        <partialTransformation>PMI_RoyalMaggotMorphTfPartial</partialTransformation>
		<raceSettings>
			<graphicsSettings>
				<skinColorOverride>(154,125,94)</skinColorOverride>
			</graphicsSettings>
		</raceSettings>
    </Pawnmorph.MorphDef>
</Defs>