<Defs xmlns:xsi="http://www.w3.org/2001/XMLSchema-instance" xsi:noNamespaceSchemaLocation="https://raw.githubusercontent.com/Tachyonite/Pawnmorpher/dev/Schemas/MorphDef.xsd">
	<Pawnmorph.MorphDef ParentName="InsectMorph">
        <defName>PMI_GigawigMorph</defName>
        <label>gigawigmorph</label>
        <description>Large and usually covered in thick plates of chitin, these  morphs are effective miners and prospectors.</description>
        <race>VFEI_VatGrownGigawig</race>
		<injectorDef>PMI_GigawigInjector</injectorDef>
		<categories>
			<li>PMI_Worker</li>
		</categories>
        <fullTransformation>PMI_GigawigMorphTf</fullTransformation>
        <partialTransformation>PMI_GigawigMorphTfPartial</partialTransformation>
		<raceSettings>
			<graphicsSettings>
				<skinColorOverride>(154,125,94)</skinColorOverride>
			</graphicsSettings>
		</raceSettings>
    </Pawnmorph.MorphDef>
</Defs>