<Defs xmlns:xsi="http://www.w3.org/2001/XMLSchema-instance" xsi:noNamespaceSchemaLocation="../../../Schemas/MorphDef.xsd">
    <Pawnmorph.MorphDef ParentName="PMI_WorkerInsectBase">
        <defName>PMI_GigawigMorph</defName>
        <label>gigawigmorph</label>
        <description>Large and usually covered in thick plates of chitin, these  morphs are effective miners and prospectors.</description>
        <race>VFEI_VatGrownGigawig</race>
        <fullTransformation>PMI_GigawigMorphTf</fullTransformation>
        <partialTransformation>PMI_GigawigMorphTfPartial</partialTransformation>
    </Pawnmorph.MorphDef>
</Defs>