<Defs xmlns:xsi="http://www.w3.org/2001/XMLSchema-instance" xsi:noNamespaceSchemaLocation="../../../Schemas/MorphDef.xsd">
    <Pawnmorph.MorphDef ParentName="PMI_ProductionInsectBase">
        <defName>PMI_SpiderweaverMorph</defName>
        <race>VFEI_VatGrownSpiderweaver</race>
        <label>spiderweaver morph</label>
        <description>'Weavermorphs' tend to sit in their rooms, think about their life, and play chess -- all while they're spinning their own silk. It's not a pleasant process and we prefer to leave it up to the imagination.</description>
        <fullTransformation>PMI_SpiderWeaverMorphTf</fullTransformation>
        <partialTransformation>PMI_SpiderWeaverMorphTfPartial</partialTransformation>
    </Pawnmorph.MorphDef>
</Defs>